adult,backdrop_path,genre_ids,id,original_language,original_title,overview,popularity,poster_path,release_date,title,video,vote_average,vote_count
False,/2Nti3gYAX513wvhp8IiLL6ZDyOm.jpg,"[10751, 35, 12, 14]",950387,en,A Minecraft Movie,"Four misfits find themselves struggling with ordinary problems when they are suddenly pulled through a mysterious portal into the Overworld: a bizarre, cubic wonderland that thrives on imagination. To get back home, they'll have to master this world while embarking on a magical quest with an unexpected, expert crafter, Steve.",276.6921,/iPPTGh2OXuIv6d7cwuoPkw8govp.jpg,2025-04-02,A Minecraft Movie,False,6.161,846
False,/nAxGnGHOsfzufThz20zgmRwKur3.jpg,"[28, 27, 53]",1233413,en,Sinners,"Trying to leave their troubled lives behind, twin brothers return to their hometown to start again, only to discover that an even greater evil is waiting to welcome them back.",149.8042,/jYfMTSiFFK7ffbY2lay4zyvTkEk.jpg,2025-04-17,Sinners,False,7.57,626
False,/rdxdvXQGqCj2Vb7SvTL8gdxlSzI.jpg,"[80, 53, 28]",870028,en,The Accountant²,"When an old acquaintance is murdered, Wolff is compelled to solve the case. Realizing more extreme measures are necessary, Wolff recruits his estranged and highly lethal brother, Brax, to help. In partnership with Marybeth Medina, they uncover a deadly conspiracy, becoming targets of a ruthless network of killers who will stop at nothing to keep their secrets buried.",74.7749,/kMDUS7VmFhb2coRfVBoGLR8ADBt.jpg,2025-04-24,The Accountant²,False,7.224,143
False,/yMoEGh8kDEwqsoJumnQLwFJ9V6h.jpg,"[53, 28]",1087891,en,The Amateur,"After his life is turned upside down when his wife is killed in a London terrorist attack, a brilliant but introverted CIA decoder takes matters into his own hands when his supervisors refuse to take action.",36.0746,/SNEoUInCa5fAgwuEBMIMBGvkkh.jpg,2025-04-11,The Amateur,False,6.647,242
False,/wmqpE7p2dUCEgCnovuovoNXaCXr.jpg,"[27, 14, 53, 9648, 28]",1353117,en,Home Sweet Home: Rebirth,"When a city is overrun with a demonically-possessed crowd, a cop must find the source of evil to save his family.",32.8089,/9rCBCm9cyI4JfLEhx3EncyncMR3.jpg,2025-04-02,Home Sweet Home: Rebirth,False,6.3,57
False,/hRn5oyuhrVFjLwDpe73UvqgvPht.jpg,"[28, 14, 27]",793387,ko,거룩한 밤: 데몬 헌터스,"When a devil-worshipping criminal network plunges Seoul into chaos, the police turn to Holy Night—a trio of supernatural demon hunters—to restore order and defeat the rising evil.",19.1864,/v3Mo77Qjp6pctpD4eJaNT6kFRSB.jpg,2025-04-30,Holy Night: Demon Hunters,False,4.5,1
False,/x0pkoGlwWdkzRxgQioD3cUG0awu.jpg,"[18, 36]",1000837,pt,Ainda Estou Aqui,"In 1971, military dictatorship in Brazil reaches its height. The Paiva family — Rubens, Eunice, and their five children — live in a beachside house in Rio, open to all their friends. One day, Rubens is taken for questioning and does not return.",11.2782,/gZnsMbhCvhzAQlKaVpeFRHYjGyb.jpg,2025-04-02,I'm Still Here,False,7.98,647
False,/s7xmwFJQj99lICSGQkr8sQ7G9IA.jpg,"[35, 53]",1210732,fr,Un Ours dans le Jura,"Michel and Cathy, wed for longer than they can remember, lead a quiet but monotonous life in the mountains. When a bear bursts out in front of Michel’s car, accidentally killing two drug dealers and revealing a €2 million loot in the process, their life takes an unpredictable turn, especially when they decide to cover up the incident and keep the money! But their plan leads them to stumble upon an unexplained trail of dead bodies. More used to being honest than crooked, Michel and Cathy’s clumsy cover-up efforts soon put an interfering inspector hot on their trail.",7.5016,/oovadj4TsgCuAGfd5LhDP19ZCYD.jpg,2025-04-11,How to Make a Killing,False,6.578,134
False,/yn16m5rlqE0ZAP5WSk6gvsM0zBM.jpg,"[16, 28, 878]",1326106,ja,アニメ『怪獣８号』第１期総集編／同時上映「保科の休日」,"In a Kaiju-filled Japan, Kafka Hibino works in monster disposal. After reuniting with his childhood friend Mina Ashiro, a rising star in the anti-Kaiju Defense Force, he decides to pursue his abandoned dream of joining the Force, when he suddenly transforms into the powerful ""Kaiju No. 8."" An action-packed recap of the first season of Kaiju No. 8 and a new original episode, Hoshina's Day Off.",6.8107,/2mU8qUbYKlHBdmDDbCmKLuqXd1m.jpg,2025-05-01,Kaiju No. 8: Mission Recon,False,6.6,7
False,/21lM9hfYNDX9RnWzp4aq0iQTEbq.jpg,"[16, 10749]",1317276,ja,映画 ギヴン 海へ,Second part of Given Movie: Hiiragi Mix.,4.5135,/2VLnT5JtJ77ErG6GD3c1J628VLp.jpg,2025-04-02,Given the Movie: To the Sea,False,9.0,2
False,,[18],1200063,zh,猎金·游戏,"Talented financial student Gao Han has integrity, outstanding professional ability, and is bent-minded to make a difference in the financial field. Because Zhuotong, a family business of his friend Chu Feng, is preparing for listing, Gao Han accidentally got an internship opportunity from the international investment bank Bluestone. All the interns graduated from world-famous schools. Either the family is prominent enough to bring business, or it is recommended by internal executives. Gao Han looks different and shabby in it. Fortunately, he was appreciated by chief analyst Zhang Tode and was able to participate in the IPO business of the investment bank. Under Zhang's guidance, Gao Han quickly adapted to the high-pressure and fast-paced daily life, and honed solid professional skills and negotiation skills, but he did not know that the acquisition of performance was not only for those who could.",4.3179,/9HnrAAdEPWhhzNIgoCQYtnyQI38.jpg,2025-05-09,A Gilded Game,False,0.0,0
False,/c6DH4DO5Gf1MRuFIA8omh2b6psn.jpg,"[80, 18, 53]",1233208,hi,संतोष,"A government scheme sees newly widowed Santosh inherit her husband’s job as a police constable in the rural badlands of Northern India. When a low-caste girl is found raped and murdered, she is pulled into the investigation under the wing of charismatic feminist inspector Sharma.",3.1898,/c4LdJKjE7Du2ofKsyDrmwZs9u5m.jpg,2025-04-18,Santosh,False,7.1,39
False,/zSEZoGXvik9ivEzWJ1Ltd3FfHEJ.jpg,"[16, 35]",1064307,no,Spermageddon,"Two narrative threads - one is an emerging love story between two awkward teens, Jens and Lisa, who are having sex for the first time and the other is an eventful quest of Simon the Semen and his friends to reach the golden goal, the Egg.",3.1305,/53RHhIoZ3iUyqIOdjkpJeKsvrTG.jpg,2025-04-25,Spermageddon,False,6.0,2
False,/cHzalKoJFzw8z1krTYghu2qzHV9.jpg,[35],1056648,fr,Le Procès du Chien,"April, an idealistic lawyer dedicated to lost causes, agrees to defend Cosmos, a dog that has bitten three people, leading to the first canine trial. She has no choice but to win the case, as otherwise, her unusual client will be put down.",2.8471,/pO0QHRYxSLiFGW75JwHYucEdz72.jpg,2025-04-02,Dog on Trial,False,6.3,45
False,/5w3eT4OixKdSwetOUevHBA08bKC.jpg,[27],1297028,en,Rosario,"After her estranged grandmother unexpectedly passes away, a snowstorm locks Rosario in with the body while twisted supernatural forces begin assaulting her.",2.6268,/7BkDJ4DfjkEG6NRJPeyw9w2iRFx.jpg,2025-05-09,Rosario,False,4.5,2
False,/ttiCab2MEJljWMIWBoON7IZNIup.jpg,"[35, 10749, 18]",1278827,en,The Wedding Banquet,"Frustrated with his commitment-phobic boyfriend Chris and running out of time, Min makes a proposal: a green-card marriage with their friend Angela in exchange for her partner Lee's expensive IVF. Elopement plans are upended, however, when Min's grandmother surprises them with an extravagant Korean wedding banquet.",2.3559,/rO0MshHlXeuvUC0St8I7sfBaxRb.jpg,2025-05-09,The Wedding Banquet,False,8.5,4
False,/pV1tdlFgqEY8hDDZLXyvmd9cKPM.jpg,"[28, 35, 80, 14, 27, 9648]",1317920,th,ซองแดงแต่งผี,"When Menn, a super-straight mugger-turned-police spy, accidentally picks up a mysterious red envelope, he is bound by a supernatural contract that forces him to wed a ghost. Fate plays an even crueler trick on him: his ""spouse"" is not only dead, but a cute and unapologetically progressive gay man named Titi.",1.5454,/snuY7UUVTqAJmG5hPUImKhFUTOl.jpg,2025-05-09,The Red Envelope,False,4.5,2
False,/eV3eYDP3dIM6l2T2V9Ad62aJzJn.jpg,"[18, 10749]",1404326,ja,366⽇,"In 2003, Minato Makiya (Eiji Akaso) attends high school in Okinawa as a senior. He meets junior student Miu Tamashiro (Moka Kamishiraishi) from the same high school. They share the same love for music and are attracted to each other. On Minato Makiya’s graduation day, he confesses his feelings to her and they begin to have a romantic relationship. Then, Minato Makiya’s mother dies from a disease. Minato Makiya is about to give up on his dream of making music, but Miu Tamashiro persuades him to go to a university in Tokyo. Two years later, Miu Tamashiro comes to Tokyo. They reunite and enjoy their time together, while Miu Tamashiro pursues her dream of becoming a translator. One day, Minato Makiya suddenly breaks up with her and he disappears.",0.8791,/7K8z4nVTsUs2xfIzRxGYtJufpbj.jpg,2025-04-02,366 Days,False,0.0,0
False,/yHirNou62aeQwEQiuqcEqcgXLAp.jpg,[18],1274751,en,Blue Sun Palace,"A sudden loss catalyzes an unlikely bond between two migrants in the Chinese community of Queens. Navigating lives far from home and the painstaking labor that supports them, they journey through grief together in hopes of finding family.",0.822,/wLUn3onoWmUh04XTI5ZRQAwrAi.jpg,2025-04-30,Blue Sun Palace,False,6.0,4
False,/8qCO07RAU2qpTHHOJoASQ0EBLH7.jpg,"[53, 27]",1063857,cn,贖夢,A psychiatrist attempts to help an insomniac cabbie suffering from horrific and violent recurring nightmares which are spilling over and infecting their waking hours.,0.751,/b5SUL7UVS1Y7qWlXtCCFFz1lqsg.jpg,2025-04-11,Peg O' My Heart,False,0.0,0
False,/oljS0LzemMxyEPyqLxEqkGu9XTU.jpg,[18],1239041,cn,看我今天怎麼說,"Wolf, born into a deaf family, embraces sign language with confidence despite obstacles in life; Sophie, having received a cochlear implant at a young age, continuously strives to be seen as ""normal"" despite having a ""deaf accent."" Alan, with a cochlear implant like Sophie, is capable of both spoken language and sign language; he advocates for diverse modes of communication within the deaf community. Bound by love and friendship, the three embark on a self-discovering journey that is not without its moments of pain.",0.7575,/wPrmHp04hVYIpVKPajSKyFmaHio.jpg,2025-04-30,The Way We Talk,False,0.0,0
False,/l30cJrcUOCYFyyMZ5nRxknq9fVR.jpg,"[16, 35, 10751, 14, 12]",1275261,en,Rebellious,"In this modern twist on a classic fairy tale, a headstrong princess is stolen by an evil sorcerer, and her scholarly fiancé must use his wits in an epic quest to find her while she boldly challenges her captors and plots a daring escape.",0.6215,/kUAP8vw4Bklp9Z01H9K0k6iRihk.jpg,2025-04-02,Rebellious,False,7.4,4
False,/kpuFZX615XaVUZ3DzXBQhv4ejAo.jpg,[18],1235294,fr,La Réparation,"A few hours before his third Michelin star was awarded, a renowned chef disappeared with his second chef during a hunting trip. His daughter Clara found herself alone at the head of the restaurant, harassed by paparazzi. Two years later, she received an invitation to a renowned gastronomic congress in Taiwan.",0.5815,/NZAHBIcDuNA0LYlU2UGhCjfwuJ.jpg,2025-04-18,La Réparation,False,5.4,15
False,/4ggd2yJ0YpWEpAwnJ75NUzByRkc.jpg,"[18, 9648, 53]",940247,zh,刺心切骨,"When his dangerous older brother is released from prison, high school fencer Jie helps him, defying their mother's attempts to bury his existence.",0.5875,/87yscLQThosHx2VwnUGX1LfmhCZ.jpg,2025-04-18,Pierce,False,7.5,2
False,/1CcRNVxAYXLRVew7cQXoVPwi3Es.jpg,"[16, 18, 12, 14]",597398,lv,Projām,"After suffering a plane crash on a mysterious island, a young man embarks on an epic journey through forests, deserts and mountains trying to escape the shadow of a huge dark spirit.",0.4939,/c59eplVELdwrUfGBUAZVin3HfaL.jpg,2025-04-11,Away,False,6.382,93
False,/9I1vkFmEGqJiod3lbWFSj47HDo8.jpg,"[35, 10751, 27, 18]",1396079,vi,Nhà Gia Tiên,"A Gen Z content creator returns to her ancestral home seeking viral material, only to encounter her deceased brother’s ghost while dealing with avaricious relatives.",0.8115,/ddbDdGF2xFUgwXPb1zhCoGWuOdV.jpg,2025-04-02,The Ancestral Home,False,9.0,3
False,/oGVLGGeUSHdT7xfd3IVXx1BjjF.jpg,[99],1320480,fr,"Miyazaki, l'esprit de la nature",A documentary that focuses on Hayao Miyazaki’s deep connection to nature and the environmental themes expressed through his films.,0.5126,/bvi53EThuUP5YQcd4LoaUnPIEw5.jpg,2025-05-09,"Miyazaki, Spirit of Nature",False,0.0,0
False,/t0K2ySBRHqndcMt2VJGEFzhyHFy.jpg,[10402],1467526,zh,Star Rail LIVE 2025 - Honkai: Star Rail 2nd Anniversary Concert,"Celebrate Honkai: Star Rail's 2nd Anniversary with a one-day-only, cinema screening featuring powerful performances of the Space Fantasy RPG's most iconic tracks! This screening showcases recorded performances from the Star Rail LIVE 2025 concert held in Shanghai on May 3, 2025.",0.4208,/oBkzIO2tTHgxCxdZLULonpnbzvf.jpg,2025-05-03,Star Rail LIVE 2025 - Honkai: Star Rail 2nd Anniversary Concert,False,0.0,0
False,/obsNFIbCY2lIvtmTis8UOaaZP5F.jpg,"[878, 28, 18]",1392079,ja,ウルトラマンアークTHE MOVIE 超次元大決戦！光と闇のアーク,"A mysterious space sage entrusts Yuma with challenges that surpass the limits of his imagination with a stake too high. He asks, ""Should you fail… then you… will lose your power as Arc."" The burden of protecting Hoshimoto City alongside SKIP members are twisted by Sascal, who manipulates them, sending challenge after challenge toward Yuma.  Battling giant kaiju, an evil alien bent on destruction, and a warped dimension where even time itself is distorted, Yuma must confront the ultimate test. Will he... will Ultraman Arc overcome the greatest challenge yet and protect the future, surpassing the limits of the power of imagination?",0.3267,/2u7FihanLcvXIGqbbci32qfiL91.jpg,2025-04-02,Ultraman Arc the Movie: The Clash of Light and Evil,False,7.0,1
False,,"[18, 53]",1368326,ja,ショウタイムセブン,"Orimoto Shinnosuke, a former popular news anchor, was forced to leave the nationwide news program “Showtime 7” for a certain reason. Orimoto, now a negotiator, forcefully goes live on air to negotiate with a bomber. Based on the 2013 Korean film “Terror, Live.”",0.3169,/3gDgTaoSkz8LB62ahv5JMRAmtd5.jpg,2025-04-18,SHOWTIME7,False,0.0,0
False,,"[27, 53]",1276131,th,ผู้เช่า,When a young graphic designer has to rent a dorm that has a terrifying story and mysterious neighbors. That will bring fear to every tenant.,0.3611,/wBrbYlOVXRfeefvfgeJI5btS1Ow.jpg,2025-04-25,The Tenant,False,4.5,2
False,/vbpb7b9uchu2lY5d5rizYElk7Pd.jpg,"[10749, 14]",1323008,ja,知らないカノジョ,"Riku Kambayashi was a university student, who wanted to become a novel writer. Minami Maezono was a university student, who wanted to become a singer. They fell in love at first sight and married while they were university students. Now, Riku has achieved his dream of becoming a bestselling writer, but Minami hasn’t achieved her dream of becoming a singer. Minami somehow feels disconnected from her husband, who is busy with his work. One day, a comment by Riku triggers a big argument between them. When Riku wakes up the next morning, he finds that Minami is nowhere to be found. He goes to the publisher for a meeting, but he figures out that he now works as an editor of a literary magazine. More surprisingly, Minami is active as a popular singer-songwriter. Riku is confused by everything that has changed, but he gets busy to get his life back.",0.3383,/p9ZefGoangnFu3AKFMC1znUpATP.jpg,2025-04-02,My Beloved Stranger,False,8.0,1
False,,"[28, 18, 80]",1005985,zh,器子,"A series of tragic events unfolds after Chang Chi-Mao's daughter goes missing as an infant. Chang becomes consumed by revenge against a powerful criminal organization suspected of kidnapping her. Along the way, he clings to the hope that his daughter may still be alive, determined to rescue her and break free from their dark fate.",0.309,/1S1vakUhL2hDEDQVhL2kmZGKztJ.jpg,2025-04-11,Organ Child,False,5.25,2
False,/meijJqvTcedZi7RmbNYNWRLfso0.jpg,"[10402, 99]",1377930,ja,劇場版 Ado SPECIAL LIVE「心臓」,"Attracting 140,000 fans over two days (April 27–28, 2024), “Shinzou” was a legendary performance that established Ado the first solo female artist to perform at the iconic Japan National Stadium. The setlist featured 26 songs including her on-stage duet of “Sakura Biyori and Time Machine (with Hatsune Miku),” the highly acclaimed “DIGNITY” featuring guest guitarist Tak Matsumoto (from B’z), and “Show,” a collaboration song with Universal Studios Japan. The theatrical release promises a fresh and immersive experience for fans who missed the live event or want to relive the moment.",0.3224,/imX6RRMjDtaynGAxmdTMqXKmBnM.jpg,2025-04-18,Ado SPECIAL LIVE “Shinzou” in Cinema,False,0.0,0
False,,[10749],1321139,zh,有病才會喜歡你,,0.3003,/dSAagxNVZmvA7eohvky20CFv5iC.jpg,2025-04-02,Lovesick,False,0.0,0
False,/oo7Wqf8pfwlBtuR2HsEovthwZIm.jpg,"[18, 10402]",1261049,it,The Opera! - Arie per un'eclissi,"A sudden gunshot shatters the dream of two lovers on their wedding day. The fate of Orpheus and Eurydice is cruel: on the very day they sought to seal their love, EurydiceΆs soul embarks on its journey to the underworld. Heartbroken, Orpheus embarks on a perilous journey to bring his beloved back from Hades. A journey that will lead the fearless hero to confront the depths of his emotions and face his greatest fears. This journey will take him through strange worlds and into encounters with some of the greatest musical pieces and arias in the history of music. Will love triumph over death?",0.3343,/7MRFneEwzffT644OsM9CvljGXf3.jpg,2025-05-09,The Opera! Arias for an Eclipse,False,7.0,1
False,/7VdX6cOziKP6DlQh3ZMLvqVSrFa.jpg,[18],1414620,zh,夏日最後的祕密,"SU Ming-yi (played by CHENG Yu-xi) holds her first photography exhibition, reflecting on her youth and thinking of YAN Li-yao (played by SHIH Bo-yu). In high school, she was the class monitor, secretly admiring YAN Li-yao. Despite his frequent absences, they crossed paths often, with her feelings hidden. YAN Li-yao and CHENG Yan (played by LIN Zi-heng) were close but had contrasting personalities. After SU Ming-yi confessed, YAN Li-yao suggested a “trial” relationship. After graduation, they each buried their secrets. Years later, through an old roll of film and a photography exhibition, these long-hidden feelings are finally revealed, offering redemption for all involved.",0.219,/kMFzAI0CGtkgTso0KE1CeJVEPDQ.jpg,2025-04-30,Summer Blue Hour,False,0.0,0
False,,"[27, 18]",1328020,th,มาลี,"Him, Dean, Chopper, and Kane, four best friends meet again at the funeral of Dean's mother. They volunteer to stay with Dean, who is left alone at his house in Ayutthaya, and help Dean with his things as Dean intends to sell the house. As soon as they step into the ancient house, a strange phenomenon begins to emerge, especially after Him accidentally puts the sacrificial manohra dancer's chada on his head. The spirit of the dancer follows Him without stopping.",0.1229,/7YF3CF3NxgD6KYBpS8aWoxCnn9d.jpg,2025-04-11,Malee,False,6.0,1
False,,[99],1452246,zh,沈睡的水下巨人,,0.102,/7DdvzQcKfGtd00tKsrmCB4ofemu.jpg,2025-04-25,Shipwrecks Taiwan,False,0.0,0
False,,[14],1437779,zh,深淵宇宙,"In the not-so-distant future, a new psychological disorder emerges among humans. Novel Fulminant Depressive Disorder (NFDD), a condition so severe it causes patients to fall into a coma due to overwhelming depression. Counselor LIN Xin-yan, whose best friend is afflicted with NFDD, crosses paths with WU Tian-rui, a brain science and engineering researcher. Combining their expertise, the two strive to piece together the inner world of the afflicted—the Abyssverse—in hopes of helping them break free. Yet, amidst their investigation, a subtle connection begins to form between them. As they went closer to each other, they also draw nearer to uncovering the truth behind the illness. Each of us lives within a sealed universe of our own. And behind that fissure of the collapse, lies either a deeper abyss of despair…? or a different kind of salvation?",0.099,/aBwXFFVcVnd977DwdjY1gsPAo93.jpg,2025-04-18,Abyssverse,False,0.0,0
False,,[99],1369302,zh,跳進部落的孩子,"At the peak of his career as a choreographer, Bulareyaung felt lost. He returned to Taitung to work with young indigenous performers. These mostly untrained dancers are fulfilling their dreams in their homeland, and their free-spirited personalities remind him of his youth. Surrounded by dancers who feel like family, Bulareyaung gradually discovers that returning to his indigenous community through dance rekindles the child within him.",0.0646,/nfpp4DyCwnN9ow9SXK9AjF3pqng.jpg,2025-04-30,Dancing Home,False,0.0,0
